,tweet_id,timestamp,text,rating_numerator,rating_denominator,p1,p1_conf,p1_dog,p2,p2_conf,p2_dog,p3,p3_conf,p3_dog,favorite_count,retweet_count
915,715342466308784130,2016-03-31 00:58:29,This is Oscar. He's a world renowned snowball inspector. It's a ruff job but someone has to do it. 10/10 great guy https://t.co/vSufMAKm3C,10,10,West Highland white terrier,59%,True,soft-coated wheaten terrier,14%,True,Lakeland terrier,13%,True,2792,622
916,715220193576927233,2016-03-30 16:52:36,This is Nico. His selfie game is strong af. Excellent use of a sneaky tongue slip. 10/10 star material https://t.co/1OBdJkMOFx,10,10,Chihuahua,58%,True,Italian greyhound,37%,True,Boston bull,1%,True,2208,587
917,715200624753819648,2016-03-30 15:34:51,This is Michelangelope. He's half coffee cup. Rare af. 12/10 would hug until someone stopped me https://t.co/tvVDY0G911,12,10,Chihuahua,95%,True,beagle,0%,True,Labrador retriever,0%,True,4747,1682
918,715009755312439296,2016-03-30 02:56:24,This is Siba. She's remarkably mobile. Very sleepy as well. 12/10 would happily transport https://t.co/TjnI33RE1i,12,10,dingo,31%,False,Chihuahua,14%,True,Cardigan,10%,True,3815,1104
919,714982300363173890,2016-03-30 01:07:18,This is Calbert. He forgot to clear his Google search history. 9/10 rookie mistake Calbert https://t.co/jRm5J3YCmj,9,10,Brittany spaniel,94%,True,beagle,2%,True,Ibizan hound,0%,True,3426,931
920,714957620017307648,2016-03-29 23:29:14,This is Curtis. He's an Albino Haberdasher. Terrified of dandelions. They really spook him up. 10/10 it'll be ok pup https://t.co/s8YcfZrWhK,10,10,Great Pyrenees,25%,True,Samoyed,13%,True,kuvasz,12%,True,3810,1277
921,714631576617938945,2016-03-29 01:53:39,This is Benedict. He's a feisty pup. Needs a brushing. Portable af. Looks very angry actually. 4/10 might not pet https://t.co/3oeFfHjv0Z,4,10,meerkat,14%,False,weasel,11%,False,black-footed ferret,9%,False,3013,897
922,714606013974974464,2016-03-29 00:12:05,Here are two lil cuddly puppers. Both 12/10 would snug like so much https://t.co/zO4eb7C4tG,12,10,Norfolk terrier,29%,True,Labrador retriever,25%,True,golden retriever,12%,True,3341,829
923,714258258790387713,2016-03-28 01:10:13,"Meet Travis and Flurp. Travis is pretty chill but Flurp can't lie down properly. 10/10 &amp; 8/10
get it together Flurp https://t.co/Akzl5ynMmE",10,10,collie,17%,True,Chesapeake Bay retriever,10%,True,beagle,10%,True,2816,667
924,714251586676113411,2016-03-28 00:43:43,This is Thumas. He hates potted plants. 8/10 wtf Thumas https://t.co/rDVueNIcEi,8,10,soft-coated wheaten terrier,75%,True,Bedlington terrier,17%,True,Great Pyrenees,1%,True,3023,758
925,714214115368108032,2016-03-27 22:14:49,Happy Easter from the squad! ðŸ‡ðŸ¶ 13/10 for all https://t.co/YMx4KWJUAB,13,10,pug,53%,True,bloodhound,16%,True,German shepherd,4%,True,2111,797
926,714141408463036416,2016-03-27 17:25:54,"I know we only rate dogs, but since it's Easter I guess we could rate a bunny for a change. 10/10 petable as hell https://t.co/O2RlKXigHu",10,10,Labrador retriever,58%,True,golden retriever,37%,True,redbone,0%,True,4000,1278
927,713919462244790272,2016-03-27 02:43:58,This is Kanu. He's a Freckled Ticonderoga. Simply flawless. 12/10 would perform an elaborate heist to capture https://t.co/7vyAzIURrE,12,10,Siberian husky,46%,True,Eskimo dog,38%,True,malamute,9%,True,3041,720
928,713761197720473600,2016-03-26 16:15:05,This is Piper. She would really like that tennis ball core. Super sneaky tongue slip. 12/10 precious af https://t.co/QP6GHi5az9,12,10,Brittany spaniel,79%,True,English springer,4%,True,Welsh springer spaniel,3%,True,4458,1239
929,713411074226274305,2016-03-25 17:03:49,Here we see an extremely rare Bearded Floofmallow. Only a few left in the wild. 11/10 would pet with a purpose https://t.co/jVJJKlPbvq,11,10,Great Pyrenees,72%,True,Samoyed,12%,True,kuvasz,12%,True,4093,1184
930,713177543487135744,2016-03-25 01:35:51,This is Lance. Lance doesn't give a shit. 10/10 we should all be more like Lance https://t.co/SqnG9Ap28J,10,10,whippet,73%,True,basenji,2%,True,Great Dane,2%,True,6643,2587
931,713175907180089344,2016-03-25 01:29:21,Say hello to Opie and Clarkus. Clarkus fell asleep so Opie buried him. Ruthless af 10/10 for both https://t.co/xT7XaY4gnW,10,10,timber wolf,50%,False,malamute,43%,True,Siberian husky,2%,True,4084,1329
932,712809025985978368,2016-03-24 01:11:29,This is Stubert. He just arrived. 10/10 https://t.co/HVGs5aAKAn,10,10,Labrador retriever,86%,True,carton,9%,False,pug,0%,True,17535,6075
933,712717840512598017,2016-03-23 19:09:09,Please don't send in any more polar bears. We only rate dogs. Thank you... 10/10 https://t.co/83RGhdIQz2,10,10,Great Pyrenees,73%,True,kuvasz,12%,True,Irish wolfhound,4%,True,11307,4504
934,712668654853337088,2016-03-23 15:53:42,Say hello to Sunny and Roxy. They pull things out of water together. 10/10 for both https://t.co/88aedAmxcl,10,10,Labrador retriever,82%,True,golden retriever,3%,True,Chihuahua,2%,True,3819,1097
935,712438159032893441,2016-03-23 00:37:48,This is Kane. He's a semi-submerged Haitian Huffleplop. Happy af. Sick waterfall. 11/10 would pat head approvingly https://t.co/7zjEC501Ul,11,10,ice bear,86%,False,Great Pyrenees,6%,True,Labrador retriever,2%,True,4901,1416
936,712097430750289920,2016-03-22 02:03:52,I can't even comprehend how confused this dog must be right now. 10/10 https://t.co/8AGcQ4hIfK,10,10,Labrador retriever,72%,True,whippet,4%,True,Chesapeake Bay retriever,4%,True,3452,932
937,712092745624633345,2016-03-22 01:45:15,This is Steven. He's inverted af. Also very helpful. Scans anything you want for free. Takes him a while tho. 7/10 https://t.co/tA0ZiQ7JcG,7,10,triceratops,23%,False,llama,15%,False,three-toed sloth,11%,False,2710,812
938,712085617388212225,2016-03-22 01:16:55,"Say hello to Olive and Ruby. They are best buddies. Both 11/10 
1 like = 1 buddy https://t.co/yagmFdKlyL",11,10,Shih-Tzu,62%,True,Tibetan terrier,12%,True,Lhasa,11%,True,3014,434
939,712065007010385924,2016-03-21 23:55:01,This is Chester. He's clearly in charge of the other dogs. Weird ass paws. Not fit for fetch. 6/10 would still pet https://t.co/o2GvskrhHt,6,10,goose,21%,False,gibbon,8%,False,pizza,8%,False,2074,568
940,711968124745228288,2016-03-21 17:30:03,Meet Winston. He's trapped in a cup of coffee. Poor pupper. 10/10 someone free him https://t.co/2e6cUtKUuc,10,10,espresso,43%,False,coffee mug,41%,False,cup,8%,False,7407,2091
941,711743778164514816,2016-03-21 02:38:34,Meet Roosevelt. He's calculating the best case scenario if he drops out instead of doing math hw. 11/10 relatable af https://t.co/QcSIRDpfVg,11,10,Lakeland terrier,45%,True,miniature poodle,21%,True,standard poodle,13%,True,2615,906
942,711732680602345472,2016-03-21 01:54:29,I want to hear the joke this dog was just told. 10/10 https://t.co/1KiuZqqOD4,10,10,dingo,36%,False,Ibizan hound,33%,True,Eskimo dog,7%,True,8070,3690
943,711694788429553666,2016-03-20 23:23:54,Oh. My. God. 13/10 magical af https://t.co/Ezu6jQrKAZ,13,10,brown bear,71%,False,Indian elephant,17%,False,water buffalo,3%,False,30236,16598
944,711652651650457602,2016-03-20 20:36:28,This is Gary. He just wanted to say hi. 9/10 very personable pup https://t.co/Sk3CbhmKSW,9,10,llama,85%,False,Arabian camel,9%,False,neck brace,1%,False,3548,819
945,711363825979756544,2016-03-20 01:28:47,"""Please, no puparazzi"" 11/10 https://t.co/nJIXSPfedK",11,10,Pembroke,75%,True,Cardigan,24%,True,basenji,0%,True,3323,1017
946,711306686208872448,2016-03-19 21:41:44,What hooligan sent in pictures w/out a dog in them? Churlish af. 3/10 just bc that's a neat fluffy bean bag chair https://t.co/wcwoGOkZvz,3,10,leatherback turtle,28%,False,loggerhead,12%,False,Dandie Dinmont,8%,True,3047,678
947,711008018775851008,2016-03-19 01:54:56,This is Chuckles. He had a balloon but he accidentally let go of it and it floated away. 11/10 hang in there pupper https://t.co/68iNM7B5gW,11,10,French bulldog,73%,True,Boston bull,15%,True,pug,2%,True,2741,559
948,710997087345876993,2016-03-19 01:11:29,Meet Milo and Amos. They are the best of pals. Both 12/10 would pet at the same time https://t.co/Mv37BHEyyD,12,10,malamute,28%,True,Eskimo dog,23%,True,Pembroke,9%,True,4215,1260
949,710844581445812225,2016-03-18 15:05:29,This is Staniel. His selfie game is strong af. 10/10 I'd snapchat with Staniel https://t.co/UgkTw7TKyM,10,10,dingo,53%,False,Pembroke,20%,True,basenji,6%,True,2350,610
950,710833117892898816,2016-03-18 14:19:56,Say hello to Sora. She's an Egyptian Pumpernickel. Mesmerizing af. 12/10 would bring home to mom https://t.co/PmTR4kxZkq,12,10,Pembroke,80%,True,Cardigan,18%,True,German shepherd,0%,True,2466,476
951,710588934686908417,2016-03-17 22:09:38,This is Beemo. He's a Chubberflop mix. 12/10 would cross the world for https://t.co/kzMVMU8HBV,12,10,Pembroke,98%,True,Cardigan,0%,True,malamute,0%,True,4173,1697
952,710283270106132480,2016-03-17 01:55:02,This is Gunner. He's a Figamus Newton. King of the peek-a-boo. Cool jeans. 11/10 https://t.co/ONuBILIYXZ,11,10,Shih-Tzu,93%,True,Lhasa,3%,True,Tibetan terrier,0%,True,1995,480
953,710272297844797440,2016-03-17 01:11:26,We ðŸ‘ðŸ» only ðŸ‘ðŸ» rate ðŸ‘ðŸ» dogs. Pls stop sending in non-canines like this Dutch Panda Worm. This is infuriating. 11/10 https://t.co/odfLzBonG2,11,10,Old English sheepdog,58%,True,wire-haired fox terrier,11%,True,Lakeland terrier,10%,True,4147,1139
954,710269109699739648,2016-03-17 00:58:46,"The squad is back for St. Patrick's Day! â˜˜ ðŸ’š
13/10 for all https://t.co/OcCDb2bng5",13,10,pug,41%,True,German shepherd,17%,True,Labrador retriever,10%,True,2196,1013
955,710153181850935296,2016-03-16 17:18:07,This is Lacy. She's tipping her hat to you. Daydreams of her life back on the frontier. 11/10 would pet so well https://t.co/fG5Pk3Et1I,11,10,cowboy hat,97%,False,sombrero,1%,False,cocker spaniel,0%,True,2682,808
956,710140971284037632,2016-03-16 16:29:35,This is Tater. His underbite is fierce af. Doesn't give a damn about your engagement photo. 8/10 https://t.co/nLuPY3pY12,8,10,Pekinese,95%,True,papillon,1%,True,Japanese spaniel,0%,True,2515,800
957,710117014656950272,2016-03-16 14:54:24,This pupper got her hair chalked for her birthday. Hasn't told her parents yet. Rebellious af. 11/10 very nifty https://t.co/h1OX2mLtxV,11,10,toy poodle,80%,True,miniature poodle,11%,True,cocker spaniel,6%,True,5026,1780
958,709918798883774466,2016-03-16 01:46:45,Meet Watson. He's a Suzuki Tickleboop. Leader of a notorious biker gang. Only one ear functional. 12/10 snuggable af https://t.co/R1gLc5vDqG,12,10,Pembroke,95%,True,Cardigan,2%,True,Chihuahua,0%,True,3221,993
959,709901256215666688,2016-03-16 00:37:03,"WeRateDogs stickers are here and they're 12/10! Use code ""puppers"" at checkout ðŸ¶ðŸ¾

Shop now: https://t.co/k5xsufRKYm https://t.co/ShXk46V13r",12,10,bib,99%,False,handkerchief,0%,False,umbrella,0%,False,609,92
960,709852847387627521,2016-03-15 21:24:41,*lets out a tiny whimper and then collapses* ...12/10 https://t.co/BNdVZEHRow,12,10,Chihuahua,94%,True,Pomeranian,1%,True,West Highland white terrier,1%,True,3235,1089
961,709566166965075968,2016-03-15 02:25:31,This is Olaf. He's gotta be rare. Seems sturdy. Tail is floofy af. 12/10 would do whatever it takes to pet https://t.co/E9jaU59bh9,12,10,chow,99%,True,Tibetan mastiff,0%,True,Australian terrier,0%,True,3252,1072
962,709556954897764353,2016-03-15 01:48:55,This is Cecil. She's a Gigglefloof Poofer. Outdoorsy af. One with nature. 12/10 would strategically capture https://t.co/ijJB0DuOIC,12,10,golden retriever,79%,True,kuvasz,10%,True,Labrador retriever,8%,True,3022,973
963,709519240576036864,2016-03-14 23:19:03,This is Vince. He's a Gregorian Flapjeck. White spot on legs almost looks like another dog (whoa). 9/10 rad as hell https://t.co/aczGAV2dK4,9,10,cocker spaniel,41%,True,Newfoundland,22%,True,flat-coated retriever,19%,True,1385,219
964,709449600415961088,2016-03-14 18:42:20,Meet Karma. She's just a head. Lost body during the Second Punic War (unfortunate). Loves to travel 10/10 petable af https://t.co/c6af6nYEPo,10,10,Maltese dog,78%,True,Dandie Dinmont,7%,True,Norfolk terrier,3%,True,2022,517
965,709409458133323776,2016-03-14 16:02:49,This is Billy. He sensed a squirrel. 8/10 damn it Billy https://t.co/Yu0K98VZ9A,8,10,Shetland sheepdog,79%,True,collie,5%,True,keeshond,3%,True,2424,617
966,709225125749587968,2016-03-14 03:50:21,This is Walker. He's a Butternut Khalifa. Appears fuzzy af. 11/10 would hug for a ridiculous amount of time https://t.co/k6fEWHSALn,11,10,Labrador retriever,27%,True,Pomeranian,15%,True,golden retriever,14%,True,2204,520
967,709207347839836162,2016-03-14 02:39:42,This is Penny. She's trying on her prom dress. Stunning af 11/10 https://t.co/qcZDZGCapg,11,10,Chihuahua,94%,True,Italian greyhound,1%,True,quilt,1%,False,11409,5172
968,709158332880297985,2016-03-13 23:24:56,Meet Rodney. He's a Ukranian Boomchicka. Outside but would like to be inside. Only has one ear (unfortunate) 10/10 https://t.co/FjAj3ggXrR,10,10,Siberian husky,21%,True,Eskimo dog,17%,True,Labrador retriever,17%,True,1875,366
969,709042156699303936,2016-03-13 15:43:18,This is Klevin. He's addicted to sandwiches (yes a hotdog is a sandwich fight me) It's tearing his family apart 9/10 https://t.co/7BkkVNu5pd,9,10,hotdog,82%,False,Rottweiler,6%,True,Labrador retriever,4%,True,4329,1477
970,708845821941387268,2016-03-13 02:43:08,Here's a pupper with magic eyes. Not wearing a seat belt tho (irresponsible af). Very distracting to driver. 9/10 https://t.co/5DLJB4ssvI,9,10,schipperke,74%,True,kelpie,16%,True,Boston bull,1%,True,2738,802
971,708834316713893888,2016-03-13 01:57:25,Meet Malikai. He was rolling around having fun when he remembered the inevitable heat death of the universe. 10/10 https://t.co/Vd2FqHIIGn,10,10,Eskimo dog,28%,True,giant panda,21%,False,malamute,18%,True,1550,449
972,708810915978854401,2016-03-13 00:24:26,This is Mister. He's a wonderful father to his two pups. Heartwarming af. 10/10 for all https://t.co/2KcuJXL2r4,10,10,golden retriever,97%,True,Labrador retriever,1%,True,Norfolk terrier,0%,True,15218,6246
973,708738143638450176,2016-03-12 19:35:15,This is Coco. She gets to stay on the Bachelor for another week. Super pumped 11/10 https://t.co/wsCB6LFNxD,11,10,Pomeranian,93%,True,Samoyed,5%,True,West Highland white terrier,0%,True,2538,739
974,708711088997666817,2016-03-12 17:47:45,This is Smokey. He really likes tennis balls. 11/10 https://t.co/Ah7WlYTUBQ,11,10,tennis ball,91%,False,German short-haired pointer,5%,True,Labrador retriever,1%,True,2334,638
975,708479650088034305,2016-03-12 02:28:06,Meet Bear. He's a Beneboop Cumberclap. Extremely unamused. 13/10 I'm in love with this picture https://t.co/uC8kUqAz0W,13,10,Shih-Tzu,21%,True,Lhasa,20%,True,Norfolk terrier,16%,True,2338,617
976,708469915515297792,2016-03-12 01:49:25,This is Bobble. He's a Croatian Galifianakis. Hears everything within 400 miles. 11/10 would snug diligently https://t.co/VwDc6PTDzk,11,10,Chihuahua,74%,True,toy terrier,12%,True,Pembroke,4%,True,2849,729
977,708356463048204288,2016-03-11 18:18:36,This is Oliver. That is his castle. He protects it with his life. He's also squishy af. 10/10 would squish softly https://t.co/oSuEGw0BhX,10,10,pug,87%,True,French bulldog,4%,True,bath towel,1%,False,3306,1199
978,708349470027751425,2016-03-11 17:50:48,This is River. He's changing the trumpet game. Innovative af. 11/10 such a good boy https://t.co/tK7a0AxQfd,11,10,muzzle,24%,False,basenji,18%,True,Boston bull,9%,True,2184,676
979,708149363256774660,2016-03-11 04:35:39,This is Jebberson. He's the reigning hide and seek world champion. 10/10 hasn't lost his touch https://t.co/VEFkvWCoHF,10,10,Cardigan,35%,True,basset,16%,True,toy terrier,8%,True,3987,1412
980,708130923141795840,2016-03-11 03:22:23,Please stop sending in non canines like this Guatemalan Twiggle Bunny. We only rate dogs. Only send in dogs... 11/10 https://t.co/XKhobeGuvT,11,10,French bulldog,71%,True,Chihuahua,26%,True,Cardigan,0%,True,3098,784
981,708119489313951744,2016-03-11 02:36:57,This is Cooper. He basks in the glory of rebellion. 9/10 probably a preteen https://t.co/kDamUfeIpm,9,10,Norwich terrier,26%,True,Norfolk terrier,25%,True,chow,9%,True,2478,896
982,708109389455101952,2016-03-11 01:56:49,This is Remington. He was caught off guard by the magical floating cheese. Spooked af. 10/10 deep breaths pup https://t.co/mhPSADiJmZ,10,10,Staffordshire bullterrier,51%,True,American Staffordshire terrier,23%,True,kelpie,6%,True,1800,501
983,708026248782585858,2016-03-10 20:26:26,Everybody stop what you're doing and watch this video. Frank is stuck in a loop. 13/10 (Vid by @klbmatty) https://t.co/5AJs8TIV1U,13,10,malinois,78%,True,Chesapeake Bay retriever,6%,True,Siamese cat,2%,False,4064,1749
984,707995814724026368,2016-03-10 18:25:30,This is Farfle. He lost his back legs during the Battle of Gettysburg. Goes 0-60 in 4.3 seconds (damn) 12/10 hero af https://t.co/NiQQWzIzzq,12,10,agama,17%,False,Gila monster,12%,False,lumbermill,5%,False,2865,1013
985,707969809498152960,2016-03-10 16:42:10,Meet Rufus. He's a Honeysuckle Firefox. Curly af. Badass tie. About to go on his first date ever 11/10 good luck pup https://t.co/dGoTWNfIsm,11,10,toy poodle,90%,True,miniature poodle,8%,True,teddy,0%,False,2484,867
986,707776935007539200,2016-03-10 03:55:45,This is Sadie. She's a Bohemian Rhapsody. Remarkably portable. Could sneak on roller coasters with (probably). 11/10 https://t.co/DB8fyeDs8B,11,10,miniature pinscher,89%,True,toy terrier,5%,True,Chihuahua,1%,True,3006,872
987,707741517457260545,2016-03-10 01:35:01,When your roommate eats your leftover Chili's but you pretend it's no big deal cuz you fat anyway. 10/10 head up pup https://t.co/0nMgoue8IR,10,10,whippet,73%,True,Italian greyhound,19%,True,American Staffordshire terrier,2%,True,2289,555
988,707693576495472641,2016-03-09 22:24:31,This is Jiminus. He's in a tub for some reason. What a jokester. Smh 7/10 churlish af https://t.co/84L4ED9Tpi,7,10,bathtub,49%,False,tub,48%,False,washbasin,0%,False,3123,915
989,707610948723478529,2016-03-09 16:56:11,This is Harper. She scraped her elbow attempting a backflip off a tree. Valiant effort tho. 12/10 https://t.co/oHKJHghrp5,12,10,golden retriever,38%,True,cocker spaniel,16%,True,Chesapeake Bay retriever,11%,True,15583,5714
990,707420581654872064,2016-03-09 04:19:44,This is Keurig. He's a rare dog. Laughs like an idiot tho. Head is basically a weapon. Poorly maintained goatee 4/10 https://t.co/xOrUyj7K30,4,10,ram,51%,False,kuvasz,14%,True,Great Pyrenees,10%,True,2070,632
991,707411934438625280,2016-03-09 03:45:22,"""I shall trip the big pupper with leash. Big pupper will never see it coming. I am a genius."" Both 11/10 https://t.co/uQsCJ8pf51",11,10,Lakeland terrier,73%,True,Airedale,2%,True,giant schnauzer,2%,True,2112,543
992,707387676719185920,2016-03-09 02:08:59,Meet Clarkus. He's a Skinny Eastern Worcestershire. Can tie own shoes (impressive af) 10/10 would put on track team https://t.co/XP5o7zGn0E,10,10,Chihuahua,88%,True,Italian greyhound,8%,True,toy terrier,1%,True,3217,1147
993,707377100785885184,2016-03-09 01:26:57,This dog just brutally murdered a snowman. Currently toying with its nutritious remains 9/10 would totally still pet https://t.co/iKThgKnW1j,9,10,golden retriever,63%,True,bloodhound,9%,True,cocker spaniel,6%,True,3008,974
994,707315916783140866,2016-03-08 21:23:50,This is Finnegus. He's trapped in a snow globe. Poor pupper. 10/10 would make sure no one shook it https://t.co/BjpOa52jQ4,10,10,Bernese mountain dog,97%,True,Shetland sheepdog,1%,True,Appenzeller,0%,True,2283,578
995,707297311098011648,2016-03-08 20:09:54,This is Cassie. She can go from sweet to scary af in a matter of seconds. 10/10 points deducted for cats on pajamas https://t.co/B6dmZmJBdK,10,10,Blenheim spaniel,37%,True,Shih-Tzu,20%,True,black-footed ferret,10%,False,2579,709
996,707059547140169728,2016-03-08 04:25:07,Say hello to Cupcake. She's an Icelandic Dippen Dot. Confused by the oddly geometric lawn pattern. 11/10 https://t.co/D7rorf4YKL,11,10,Samoyed,89%,True,Great Pyrenees,3%,True,kuvasz,1%,True,2399,619
997,707038192327901184,2016-03-08 03:00:15,This is Kathmandu. He sees every move you make. Probably knows Jiu-Jitsu. 10/10 mysterious af https://t.co/z0cs7E4Xjj,10,10,pug,64%,True,llama,5%,False,French bulldog,5%,True,2015,716
998,707021089608753152,2016-03-08 01:52:18,This is Tucker. He's a Dasani Episcopalian. Good lord what a tongue. 12/10 would never let go of https://t.co/gHtW5cgyy7,12,10,cocker spaniel,55%,True,golden retriever,31%,True,Pekinese,6%,True,3729,1221
999,707014260413456384,2016-03-08 01:25:10,This is Ellie. She requests to be carried around in a lacrosse stick at all times. 11/10 impossible to say no https://t.co/15yCmd43zU,11,10,Chihuahua,58%,True,Italian greyhound,12%,True,toy terrier,8%,True,2113,539
1000,706901761596989440,2016-03-07 17:58:08,This is Elliot. He's blocking the roadway. Downright rude as hell. Doesn't care that you're already late. 3/10 https://t.co/FMUxir5pYu,3,10,wild boar,85%,False,hog,12%,False,warthog,1%,False,1882,522
1001,706681918348251136,2016-03-07 03:24:33,Say hello to Katie. She's a Mitsubishi Hufflepuff. Curly af. 12/10 I'd do terrible things to acquire such a pup https://t.co/CFPIcGcwJv,12,10,toy poodle,71%,True,miniature poodle,15%,True,Norwich terrier,4%,True,3024,890
1002,706644897839910912,2016-03-07 00:57:27,Meet Shadow. She's tired of the responsibilities associated with being a dog. No longer strives to attain ball. 9/10 https://t.co/cdOkfEpjFw,9,10,space heater,13%,False,Chihuahua,13%,True,cougar,11%,False,2343,982
1003,706593038911545345,2016-03-06 21:31:22,Here's a sneak peek of me on spring break. 10/10 so many tired pups these days https://t.co/6aJrjKfNqX,10,10,four-poster,69%,False,quilt,18%,False,pillow,2%,False,1982,581
1004,706538006853918722,2016-03-06 17:52:42,"This is Oliver (pronounced ""Ricardo""). He's a ship captain. Controls these treacherous waters. 11/10 would sail with https://t.co/bxjO45rXKd",11,10,chow,54%,True,Pembroke,9%,True,Pomeranian,8%,True,3187,1287
1005,706516534877929472,2016-03-06 16:27:23,Please enjoy this pup in a cooler. Permanently ready for someone to throw a tennis ball his way. 12/10 https://t.co/KUS0xl7XIp,12,10,golden retriever,77%,True,Labrador retriever,7%,True,golfcart,2%,False,2873,929
1006,706346369204748288,2016-03-06 05:11:12,This is Koda. She's a Beneboom Cumberwiggle. 12/10 petable as hell https://t.co/VZV6oMJmU6,12,10,Tibetan mastiff,95%,True,Rottweiler,2%,True,Appenzeller,0%,True,3168,842
1007,706310011488698368,2016-03-06 02:46:44,Here's a very sleepy pupper. Thinks it's an airplane. 12/10 would snug for eternity https://t.co/GGmcTIkBbf,12,10,Pembroke,69%,True,Chihuahua,10%,True,bloodhound,6%,True,19517,7124
1008,706291001778950144,2016-03-06 01:31:11,When you're just relaxin and having a swell time but then remember you have to fill out the FAFSA ...11/10 https://t.co/qy33OBcexg,11,10,Border terrier,58%,True,bull mastiff,16%,True,Staffordshire bullterrier,10%,True,1565,435
1009,706265994973601792,2016-03-05 23:51:49,"This is Kara. She's been trying to solve that thing for 3 days. ""I don't have thumbs,"" she said. 11/10 solid effort https://t.co/lA6a8GefrV",11,10,papillon,74%,True,Pekinese,11%,True,Saint Bernard,4%,True,2516,848
1010,706166467411222528,2016-03-05 17:16:20,This is Dexter. He's a shy pup. Doesn't bark much. Dreadful fetcher. Has rare sun allergy. 7/10 still petable https://t.co/sA7P3JSqiv,7,10,Samoyed,43%,True,kuvasz,27%,True,Great Pyrenees,11%,True,4718,1447
1011,705975130514706432,2016-03-05 04:36:02,This is Adele. Her tongue flies out of her mouth at random. It's a debilitating illness. 10/10 stay strong pupper https://t.co/cfn81n3FLO,10,10,Staffordshire bullterrier,58%,True,American Staffordshire terrier,28%,True,bull mastiff,9%,True,2861,662
1012,705970349788291072,2016-03-05 04:17:02,This is Lucy. She's a Venetian Kerploof. Supposed to be navigating. Quite irresponsible. Fancy ass collar tho 12/10 https://t.co/8tjnz1L8DI,12,10,golden retriever,77%,True,Labrador retriever,11%,True,chow,3%,True,2921,795
1013,705898680587526145,2016-03-04 23:32:15,Meet Max. He's a Fallopian Cephalopuff. Eyes are magical af. Lil dandruff problem. No big deal 10/10 would still pet https://t.co/c67nUjwmFs,10,10,collie,80%,True,Border collie,5%,True,groenendael,2%,True,2181,494
1014,705591895322394625,2016-03-04 03:13:11,"""Ma'am, for the last time, I'm not authorized to make that type of transaction"" 11/10 https://t.co/nPTBsdm3BF",11,10,basenji,87%,True,Italian greyhound,4%,True,miniature pinscher,3%,True,2909,1027
1015,705475953783398401,2016-03-03 19:32:29,Say hello to Zara. She found a sandal and couldn't be happier. 12/10 great work https://t.co/zQUuVu812n,12,10,golden retriever,90%,True,Labrador retriever,3%,True,tennis ball,0%,False,2741,825
1016,705442520700944385,2016-03-03 17:19:38,This is Cooper. He only wakes up to switch gears. 12/10 helpful af https://t.co/EEIkAGVY64,12,10,Great Pyrenees,30%,True,kuvasz,22%,True,seat belt,20%,False,4064,1459
1017,705428427625635840,2016-03-03 16:23:38,This is Ambrose. He's an Alfalfa Ballyhoo. Draws pistol fast af. Pretty much runs the frontier. 11/10 lethal pupper https://t.co/ih6epBOxIA,11,10,Chihuahua,77%,True,quilt,7%,False,Pembroke,2%,True,3508,1517
1018,705239209544720384,2016-03-03 03:51:44,This is Jimothy. He lost his body during the the Third Crusade (tragic). 11/10 heroic af tho https://t.co/wnsblfu7XE,11,10,Chihuahua,15%,True,toy terrier,8%,True,Mexican hairless,6%,True,2772,677
1019,705223444686888960,2016-03-03 02:49:06,This is Bode. He's a heavy sleeper. 9/10 https://t.co/YMkxhGWUqv,9,10,Egyptian cat,9%,False,Chesapeake Bay retriever,7%,True,Mexican hairless,4%,True,2375,712
1020,705102439679201280,2016-03-02 18:48:16,This is Terrenth. He just stubbed his toe. 10/10 deep breaths Terrenth https://t.co/Pg18CDFC7Z,10,10,collie,45%,True,chow,27%,True,Pomeranian,7%,True,1961,472
