,tweet_id,timestamp,text,rating_numerator,rating_denominator,p1,p1_conf,p1_dog,p2,p2_conf,p2_dog,p3,p3_conf,p3_dog,favorite_count,retweet_count
1447,676237365392908289,2015-12-14 03:08:46,Say hello to Winston. He has no respect for the system. Much rebellion. I think that's a palm tree... nice. 8/10 https://t.co/dOLQddhXLZ,8,10,French bulldog,96%,True,Chihuahua,2%,True,Boston bull,0%,True,1090,250
1448,676219687039057920,2015-12-14 01:58:31,This is Kenneth. He's stuck in a bubble. 10/10 hang in there Kenneth https://t.co/uQt37xlYMJ,10,10,bubble,99%,False,leafhopper,0%,False,whippet,0%,True,70757,27677
1449,676215927814406144,2015-12-14 01:43:35,This is Herm. He just wants to be like the other dogs. Sneaky tongue slip. Super fuzzy. 9/10 would cuddle firmly https://t.co/tg8h9lzCHv,9,10,hamster,99%,False,guinea pig,0%,False,broccoli,0%,False,1573,516
1450,676191832485810177,2015-12-14 00:07:50,These two pups just met and have instantly bonded. Spectacular scene. Mesmerizing af. 10/10 and 7/10 for blue dog https://t.co/gwryaJO4tC,10,10,Chihuahua,37%,True,Italian greyhound,17%,True,muzzle,7%,False,2053,915
1451,676146341966438401,2015-12-13 21:07:04,This is Bert. He likes flowers. 10/10 https://t.co/lmQRrNxaQu,10,10,Irish water spaniel,38%,True,standard poodle,28%,True,greenhouse,3%,False,1751,585
1452,676101918813499392,2015-12-13 18:10:33,Meet Striker. He's ready for Christmas. 11/10 https://t.co/B3xxSLjQSH,11,10,Shih-Tzu,22%,True,Norfolk terrier,18%,True,Irish terrier,10%,True,2580,1048
1453,676098748976615425,2015-12-13 17:57:57,Extremely rare pup here. Very religious. Always praying. Too many legs. Not overwhelmingly fluffy. Won't bark. 3/10 https://t.co/REyE5YKVBb,3,10,walking stick,16%,False,sandal,12%,False,purse,8%,False,2675,1246
1454,676089483918516224,2015-12-13 17:21:08,"""Yes hello I'ma just snag this here toasted bagel real quick. carry on."" 9/10 https://t.co/Cuz0Osnekp",9,10,bull mastiff,74%,True,boxer,10%,True,American Staffordshire terrier,4%,True,1183,390
1455,675898130735476737,2015-12-13 04:40:46,I'm sure you've all seen this pupper. Not prepared at all for the flying disc of terror. 10/10 https://t.co/G0pQiFGM7O,10,10,Labrador retriever,40%,True,malinois,7%,True,pug,7%,True,1445,506
1456,675891555769696257,2015-12-13 04:14:39,This is Donny. He's summoning the demon monster Babadook. 6/10 Donny please no that won't be a good time for anyone https://t.co/kiW6Knb7Gp,6,10,Italian greyhound,30%,True,whippet,23%,True,Great Dane,11%,True,1922,763
1457,675888385639251968,2015-12-13 04:02:03,Breathtaking scene. A father taking care of his newborn pup. Tugs at the heartstrings. 10/10 restores my faith https://t.co/06oZdehGEa,10,10,West Highland white terrier,67%,True,Old English sheepdog,14%,True,komondor,2%,True,2115,839
1458,675878199931371520,2015-12-13 03:21:34,"Ok, I'll admit this is a pretty adorable bunny hopping towards the ocean but please only send in dogs... 11/10 https://t.co/sfsVCGIipI",11,10,wood rabbit,78%,False,hare,11%,False,Cardigan,4%,True,3781,1237
1459,675845657354215424,2015-12-13 01:12:15,"This is Pepper. She's not fully comfortable riding her imaginary bike yet. 10/10 don't worry pupper, it gets easier https://t.co/40dj4eTsXG",10,10,pug,88%,True,Boston bull,1%,True,French bulldog,0%,True,2045,776
1460,675822767435051008,2015-12-12 23:41:18,ðŸŽ¶ HELLO FROM THE OTHER SIIIIIIIIDE ðŸŽ¶ 10/10s https://t.co/GK2HJtkdQk,10,10,Pomeranian,46%,True,chow,20%,True,Pekinese,13%,True,1385,474
1461,675820929667219457,2015-12-12 23:34:00,Here's a handful of sleepy puppers. All look unaware of their surroundings. Lousy guard dogs. Still cute tho 11/10s https://t.co/lyXX3v5j4s,11,10,basset,55%,True,beagle,20%,True,bloodhound,11%,True,956,206
1462,675798442703122432,2015-12-12 22:04:39,This is Bernie. He just touched a boob for the first time. 10/10 https://t.co/whQKMygnK6,10,10,beagle,68%,True,basset,12%,True,boxer,8%,True,9298,3039
1463,675781562965868544,2015-12-12 20:57:34,Say hello to Buddah. He was Waldo for Halloween. 11/10 https://t.co/DVAqAnb624,11,10,Maltese dog,92%,True,West Highland white terrier,1%,True,toy poodle,1%,True,1453,418
1464,675740360753160193,2015-12-12 18:13:51,Here's a pupper licking in slow motion. 12/10 please enjoy https://t.co/AUJi8ujxw9,12,10,golden retriever,80%,True,kuvasz,9%,True,Saluki,6%,True,1058,295
1465,675710890956750848,2015-12-12 16:16:45,This is Lenny. He was just told that he couldn't explore the fish tank. 12/10 smh all that work for nothing https://t.co/JWi6YrpiO1,12,10,standard schnauzer,44%,True,miniature schnauzer,24%,True,Sealyham terrier,16%,True,1686,717
1466,675706639471788032,2015-12-12 15:59:51,This is a Sizzlin Menorah spaniel from Brooklyn named Wylie. Lovable eyes. Chiller as hell. 10/10 and I'm out.. poof https://t.co/7E0AiJXPmI,10,10,English springer,99%,True,Welsh springer spaniel,0%,True,cocker spaniel,0%,True,583,85
1467,675534494439489536,2015-12-12 04:35:48,Seriously guys?! Only send in dogs. I only rate dogs. This is a baby black bear... 11/10 https://t.co/H7kpabTfLj,11,10,chow,74%,True,schipperke,13%,True,Newfoundland,4%,True,1663,361
1468,675531475945709568,2015-12-12 04:23:49,This is Ellie AKA Queen Slayer of the Orbs. Very self-motivated. Great yard. Rad foliage. 10/10 would pet diligently https://t.co/c9jmg3Xtzn,10,10,Pembroke,91%,True,Cardigan,2%,True,Siberian husky,2%,True,1066,329
1469,675522403582218240,2015-12-12 03:47:46,Meet Sammy. He's a Motorola Firefox. Hat under hoodie (must be a half-decent up and coming white rapper) 10/10 https://t.co/rO2zxf0OQ0,10,10,cocker spaniel,29%,True,golden retriever,26%,True,Irish setter,8%,True,939,249
1470,675517828909424640,2015-12-12 03:29:35,12/10 stay woke https://t.co/XDiQw4Akiw,12,10,Scottish deerhound,24%,True,groenendael,15%,True,flat-coated retriever,9%,True,1150,407
1471,675501075957489664,2015-12-12 02:23:01,"I shall call him squishy and he shall be mine, and he shall be my squishy. 13/10 https://t.co/WId5lxNdPH",13,10,dough,80%,False,bakery,2%,False,French loaf,1%,False,15523,5207
1472,675497103322386432,2015-12-12 02:07:14,Meet Reggie. He's going for the world record. Must concentrate. Focus up pup. 11/10 we all believe in you Reggie https://t.co/h3AWz4AzuC,11,10,vizsla,51%,True,miniature pinscher,6%,True,Rhodesian ridgeback,6%,True,2819,1131
1473,675489971617296384,2015-12-12 01:38:53,RT until we find this dog. Clearly a cool dog (front leg relaxed out window). Looks to be a superb driver. 10/10 https://t.co/MnTrKaQ8Wn,10,10,West Highland white terrier,13%,True,seat belt,11%,False,Old English sheepdog,9%,True,1149,526
1474,675483430902214656,2015-12-12 01:12:54,Rare shielded battle dog here. Very happy about abundance of lettuce. Painfully slow fetcher. Still petable. 5/10 https://t.co/C3tlKVq7eO,5,10,box turtle,54%,False,terrapin,20%,False,loggerhead,7%,False,1662,853
1475,675432746517426176,2015-12-11 21:51:30,Happy Friday. Here's some golden puppers. 12/10 for all https://t.co/wNkqAED6lG,12,10,Labrador retriever,98%,True,golden retriever,0%,True,Chihuahua,0%,True,1360,501
1476,675372240448454658,2015-12-11 17:51:04,"The tail alone is 13/10. Great dog, better owner https://t.co/IyAXinfyju",13,10,Chihuahua,41%,True,West Highland white terrier,10%,True,Samoyed,8%,True,1526,452
1477,675362609739206656,2015-12-11 17:12:48,This is Daisy. She loves that shoe. Still no seat belt. Super churlish. 12/10 the dogs are killing it today https://t.co/cZlkvgRPdn,12,10,Labrador retriever,47%,True,ice bear,21%,False,kuvasz,13%,True,942,192
1478,675354435921575936,2015-12-11 16:40:19,Everyone needs to watch this. 13/10 https://t.co/Bb3xnpsWBC,13,10,upright,30%,False,golden retriever,18%,True,Brittany spaniel,16%,True,29429,14867
1479,675334060156301312,2015-12-11 15:19:21,Good morning here's a grass pupper. 12/10 https://t.co/2d68FmWGGs,12,10,Pembroke,77%,True,Cardigan,11%,True,chow,3%,True,2483,1127
1480,675166823650848770,2015-12-11 04:14:49,This is Arnold. He broke his leg saving a handicapped child from a forest fire. True hero. 10/10 inspirational dog https://t.co/bijCeHeX4C,10,10,llama,28%,False,standard poodle,13%,True,teddy,12%,False,3165,1382
1481,675153376133427200,2015-12-11 03:21:23,What kind of person sends in a picture without a dog in it? 1/10 just because that's a nice table https://t.co/RDXCfk8hK0,1,10,paper towel,32%,False,mailbox,9%,False,seat belt,3%,False,5586,2259
1482,675149409102012420,2015-12-11 03:05:37,holy shit 12/10 https://t.co/p6O8X93bTQ,12,10,chow,99%,True,Tibetan mastiff,0%,True,Tibetan terrier,0%,True,3351,1496
1483,675147105808306176,2015-12-11 02:56:28,When you're presenting a group project and the 4th guy tells the teacher that he did all the work. 10/10 https://t.co/f50mbB4UWS,10,10,golden retriever,94%,True,Labrador retriever,1%,True,flat-coated retriever,1%,True,842,197
1484,675146535592706048,2015-12-11 02:54:12,This is Coops. He's yelling at the carpet. Not very productive Coops. 7/10 https://t.co/Uz52oYnHzF,7,10,dingo,28%,False,Cardigan,22%,True,Pembroke,19%,True,1052,255
1485,675145476954566656,2015-12-11 02:49:59,What an honor. 3 dogs here. Blond one is clearly a gymnast. Other two just confused. Very nifty pups. 9/10 for all https://t.co/YDgstgIDGs,9,10,Labrador retriever,45%,True,Great Dane,23%,True,Staffordshire bullterrier,11%,True,1915,779
1486,675135153782571009,2015-12-11 02:08:58,This is Steven. He got locked outside. Damn it Steven. 5/10 nice grill tho https://t.co/zf7Sxxjfp3,5,10,stove,58%,False,rotisserie,5%,False,microwave,2%,False,1164,411
1487,675113801096802304,2015-12-11 00:44:07,Meet Zuzu. He just graduated college. Astute pupper. Needs 2 leashes to contain him. Wasn't ready for the pic. 10/10 https://t.co/2H5SKmk0k7,10,10,bow,16%,False,quill,10%,False,joystick,4%,False,1735,686
1488,675111688094527488,2015-12-11 00:35:44,Say hello to Oliver. He thought what was inside the pillow should be outside the pillow. Blurry since birth. 8/10 https://t.co/lFU9W31Fg9,8,10,Labrador retriever,63%,True,Brittany spaniel,10%,True,Chesapeake Bay retriever,6%,True,867,213
1489,675109292475830276,2015-12-11 00:26:12,C'mon guys. We've been over this. We only rate dogs. This is a cow. Please only submit dogs. Thank you...... 9/10 https://t.co/WjcELNEqN2,9,10,dalmatian,98%,True,English setter,0%,True,German short-haired pointer,0%,True,2518,996
1490,675047298674663426,2015-12-10 20:19:52,This is a fluffy albino Bacardi Columbia mix. Excellent at the tweets. 11/10 would hug gently https://t.co/diboDRUuEI,11,10,Samoyed,97%,True,chow,0%,True,Pomeranian,0%,True,929,275
1491,675015141583413248,2015-12-10 18:12:05,Meet Moe. He's a golden Fetty Woof. Doesn't respect the authorities. Might own a motorhome? 10/10 revolutionary pup https://t.co/JAncIdNp8G,10,10,street sign,29%,False,golden retriever,25%,True,sandbar,13%,False,2408,1034
1492,675006312288268288,2015-12-10 17:37:00,Say hello to Mollie. This pic was taken after she bet all her toys on Ronda Rousey. 10/10 hang in there pupper https://t.co/QMmAqA9VqO,10,10,boxer,65%,True,space heater,4%,False,beagle,4%,True,875,200
1493,675003128568291329,2015-12-10 17:24:21,Meet Laela. She's adorable. Magnificent eyes. But I don't see a seat belt. Insubordinate.. and churlish. Still 12/10 https://t.co/pCGDgLkLo6,12,10,Pembroke,65%,True,Pomeranian,10%,True,Cardigan,5%,True,1390,406
1494,674805413498527744,2015-12-10 04:18:42,"When your entire life is crumbling before you and you're trying really hard to hold your shit together.
10/10 https://t.co/vqFkgYPCW8",10,10,English springer,59%,True,cocker spaniel,38%,True,Welsh springer spaniel,0%,True,760,316
1495,674800520222154752,2015-12-10 03:59:15,This is Tedders. He broke his leg saving babies from the Pompeii eruption. 11/10 where's his Purple Heart? @POTUS https://t.co/cMI2AcLm4B,11,10,Pembroke,87%,True,Cardigan,9%,True,dingo,0%,False,2693,748
1496,674790488185167872,2015-12-10 03:19:24,ER... MER... GERD 13/10 https://t.co/L1puJISV1a,13,10,Labrador retriever,80%,True,Chesapeake Bay retriever,19%,True,Rottweiler,0%,True,983,216
1497,674788554665512960,2015-12-10 03:11:43,Say hello to Maggie. She's a Western Septic Downy. Pretends to be Mexican. Great hardwood flooring. 9/10 https://t.co/P3ElQ2wsjb,9,10,miniature poodle,34%,True,toy poodle,15%,True,Maltese dog,13%,True,720,181
1498,674781762103414784,2015-12-10 02:44:43,Bedazzled pup here. Fashionable af. Super yellow. Looks hella fluffy. Webbed paws for efficient fetching. 8/10 https://t.co/ot8yMUGodj,8,10,ocarina,14%,False,hamster,6%,False,wool,3%,False,1805,1043
1499,674774481756377088,2015-12-10 02:15:47,This is Superpup. His head isn't proportional to his body. Has yet to serve any justice. 11/10 maybe one day pupper https://t.co/gxIFgg8ktm,11,10,Chihuahua,40%,True,French bulldog,30%,True,Siamese cat,22%,False,984,407
1500,674767892831932416,2015-12-10 01:49:36,This pup was carefully tossed to make it look like she's riding that horse. I have no words this is fabulous. 12/10 https://t.co/Bob33W4sfD,12,10,shower curtain,23%,False,sarong,9%,False,kimono,5%,False,1627,689
1501,674764817387900928,2015-12-10 01:37:23,These two pups are masters of camouflage. Very dedicated to the craft. Both must've spent decades practicing. 10/10s https://t.co/RBiQ8hPqwr,10,10,Samoyed,63%,True,Arctic fox,30%,False,kuvasz,1%,True,699,200
1502,674752233200820224,2015-12-10 00:47:23,Everyone please just appreciate how perfect these two photos are. 12/10 for both https://t.co/rLf7asnHxO,12,10,vizsla,66%,True,redbone,17%,True,basset,13%,True,1309,400
1503,674743008475090944,2015-12-10 00:10:43,This is Sophie. She just saw a spider. 10/10 don't just stand there Sophie https://t.co/VagYftZccT,10,10,Bernese mountain dog,58%,True,Shetland sheepdog,6%,True,Greater Swiss Mountain dog,6%,True,1259,465
1504,674739953134403584,2015-12-09 23:58:35,"""ðŸŽ¶ DO YOU BELIEVE IN LIFE AFTER LOVE ðŸŽ¶""
11/10 https://t.co/URNs5zFskc",11,10,Dandie Dinmont,17%,True,black-footed ferret,9%,False,toy poodle,6%,True,970,326
1505,674737130913071104,2015-12-09 23:47:22,Meet Rufio. He is unaware of the pink legless pupper wrapped around him. Might want to get that checked 10/10 &amp; 4/10 https://t.co/KNfLnYPmYh,10,10,Pomeranian,94%,True,schipperke,1%,True,Chihuahua,0%,True,580,80
1506,674690135443775488,2015-12-09 20:40:38,Meet Patrick. He's an exotic pup. Jumps great distances for a dog. Always gets injured when I toss him a ball. 3/10 https://t.co/Unz1uNrOzo,3,10,tick,24%,False,nail,21%,False,screw,17%,False,1024,411
1507,674670581682434048,2015-12-09 19:22:56,Meet Jeb &amp; Bush. Jeb is somehow stuck in that fence and Bush won't stop whispering sweet nothings in his ear. 9/10s https://t.co/NRNExUy9Hm,9,10,malamute,18%,True,Eskimo dog,17%,True,Siberian husky,7%,True,1447,565
1508,674664755118911488,2015-12-09 18:59:46,This is Rodman. He's getting destroyed by the surfs. Valiant effort though. 10/10 better than most puppers probably https://t.co/S8wCLemrNb,10,10,African crocodile,33%,False,American alligator,7%,False,mink,5%,False,809,205
1509,674646392044941312,2015-12-09 17:46:48,Two gorgeous dogs here. Little waddling dog is a rebel. Refuses to look at camera. Must be a preteen. 5/10 &amp; 8/10 https://t.co/YPfw7oahbD,5,10,flat-coated retriever,83%,True,groenendael,8%,True,Labrador retriever,1%,True,1280,430
1510,674644256330530816,2015-12-09 17:38:19,When you see sophomores in high school driving. 11/10 https://t.co/m6aC8d1Kzp,11,10,soccer ball,39%,False,basset,33%,True,cocker spaniel,7%,True,927,241
1511,674638615994089473,2015-12-09 17:15:54,This pupper is fed up with being tickled. 12/10 I'm currently working on an elaborate heist to steal this dog https://t.co/F33n1hy3LL,12,10,Pomeranian,84%,True,chow,14%,True,keeshond,0%,True,1517,509
1512,674632714662858753,2015-12-09 16:52:27,Rare submerged pup here. Holds breath for a long time. Frowning because that spoon ignores him. 5/10 would still pet https://t.co/EJzzNHE8bE,5,10,jellyfish,43%,False,goldfish,11%,False,coral reef,8%,False,1340,501
1513,674468880899788800,2015-12-09 06:01:26,This is Louis. He thinks he's flying. 13/10 this is a legendary pup https://t.co/6d9WziPXmx,13,10,chow,52%,True,Pomeranian,28%,True,toy poodle,6%,True,5551,1776
1514,674447403907457024,2015-12-09 04:36:06,This pupper just wants a belly rub. This pupper has nothing to do w the tree being sideways now. 10/10 good pupper https://t.co/AyJ7Ohk71f,10,10,Brabancon griffon,40%,True,malinois,24%,True,bull mastiff,7%,True,954,314
1515,674436901579923456,2015-12-09 03:54:22,Meet Bailey. She plays with her food. Very childish. Doesn't even need a battle helmet smh. Still cute though. 9/10 https://t.co/CLEOjxhTEx,9,10,acorn squash,37%,False,Shih-Tzu,10%,True,Lhasa,7%,True,989,344
1516,674422304705744896,2015-12-09 02:56:22,This is Ava. She doesn't understand flowers. 12/10 would caress firmly https://t.co/BxTJAFSIgk,12,10,golden retriever,96%,True,Labrador retriever,0%,True,tennis ball,0%,False,1282,464
1517,674416750885273600,2015-12-09 02:34:18,This is Jonah. He's a Stinted Fisher Price. Enjoys chewing on his miniature RipStik. 10/10 very upbeat fellow https://t.co/7qjXy1uUYY,10,10,Chihuahua,28%,True,Boston bull,25%,True,whippet,14%,True,611,115
1518,674410619106390016,2015-12-09 02:09:56,This is Lenny. He wants to be a sprinkler. 10/10 you got this Lenny https://t.co/CZ0YaB40Hn,10,10,brown bear,69%,False,sea lion,4%,False,beagle,1%,True,1067,400
1519,674394782723014656,2015-12-09 01:07:00,This is Gary. He's a hide and seek champion. Second only to Kony. 8/10 Gary has a gift https://t.co/cAlB4XCcsi,8,10,toilet tissue,13%,False,mosquito net,13%,False,Lakeland terrier,10%,True,1335,487
1520,674372068062928900,2015-12-08 23:36:44,Meet Chesney. On the outside he stays calm &amp; collected. On the inside he's having a complete mental breakdown. 10/10 https://t.co/G4m0TFY9uc,10,10,seashore,34%,False,American alligator,10%,False,sandbar,4%,False,766,280
1521,674318007229923329,2015-12-08 20:01:55,This is Lennon. He's in quite the predicament. 8/10 hang in there pupper https://t.co/7mf8XXPAZv,8,10,porcupine,84%,False,hamster,3%,False,echidna,1%,False,1251,449
1522,674291837063053312,2015-12-08 18:17:56,This is Kenny. He just wants to be included in the happenings. 11/10 https://t.co/2S6oye3XqK,11,10,Cardigan,61%,True,Pembroke,36%,True,Chihuahua,0%,True,13160,5130
1523,674271431610523648,2015-12-08 16:56:51,"""AT DAWN, WE RIDE""
10/10 for both dogs https://t.co/3aXX6wH6it",10,10,German shepherd,99%,True,malinois,0%,True,bloodhound,0%,True,1393,644
1524,674269164442398721,2015-12-08 16:47:50,"This is Bob. He's a Juniper Fitzsimmons. His body is 2, but his face is 85. Always looks miserable. Nice stool. 8/10 https://t.co/vYe9RlVz2N",8,10,pug,62%,True,Norwegian elkhound,4%,True,Cardigan,1%,True,825,202
1525,674265582246694913,2015-12-08 16:33:36,This is Henry. He's a shit dog. Short pointy ears. Leaves trail of pee. Not fluffy. Doesn't come when called. 2/10 https://t.co/Pu9RhfHDEQ,2,10,slug,99%,False,ice lolly,0%,False,leafhopper,0%,False,1456,728
1526,674262580978937856,2015-12-08 16:21:41,This is Gus. He's super stoked about being an elephant. Couldn't be happier. 9/10 for elephant pupper https://t.co/gJS1qU0jP7,9,10,Greater Swiss Mountain dog,51%,True,boxer,12%,True,Staffordshire bullterrier,11%,True,1179,382
1527,674255168825880576,2015-12-08 15:52:13,Say hello to Bobbay. He's a marshmallow wizard. 10/10 https://t.co/r6LZN1o1Gx,10,10,Eskimo dog,61%,True,Siberian husky,19%,True,malamute,17%,True,1301,464
1528,674082852460433408,2015-12-08 04:27:30,This is a Sagitariot Baklava mix. Loves her new hat. 11/10 radiant pup https://t.co/Bko5kFJYUU,11,10,Pomeranian,66%,True,Shetland sheepdog,2%,True,ski mask,2%,False,682,144
1529,674075285688614912,2015-12-08 03:57:26,Say hello to Mitch. He thinks that's a hat. Nobody has told him yet. 11/10 please no one tell him https://t.co/7jOPktauh4,11,10,Airedale,30%,True,Kerry blue terrier,25%,True,Lakeland terrier,18%,True,886,245
1530,674063288070742018,2015-12-08 03:09:46,This is Earl. Earl is lost. Someone help Earl. He has no tags. Just trying to get home. 5/10 hang in there Earl https://t.co/1ZbfqAVDg6,5,10,ostrich,66%,False,bearskin,21%,False,swab,6%,False,5714,1906
1531,674053186244734976,2015-12-08 02:29:37,"This is Stanley. Yes he is aware of the spoon's presence, he just doesn't know what he should do about it. 10/10 https://t.co/gQAMg5ypW5",10,10,Cardigan,98%,True,Pembroke,0%,True,kelpie,0%,True,2950,1126
1532,674051556661161984,2015-12-08 02:23:09,This is Lucy. She knits. Specializes in toboggans. 10/10 I'd buy a toboggan from Lucy https://t.co/YE2XDHy4Yk,10,10,Shih-Tzu,17%,True,badger,16%,False,three-toed sloth,13%,False,1292,431
1533,674045139690631169,2015-12-08 01:57:39,Herd of wild dogs here. Not sure what they're trying to do. No real goals in life. 3/10 find your purpose puppers https://t.co/t5ih0VrK02,3,10,robin,36%,False,rhinoceros beetle,11%,False,European fire salamander,4%,False,1268,564
1534,674042553264685056,2015-12-08 01:47:22,Yea I can't handle the cuteness anymore. Curls for days. 12/10 for all https://t.co/sAI6gCGZYX,12,10,toy poodle,92%,True,miniature poodle,6%,True,standard poodle,0%,True,636,109
1535,674038233588723717,2015-12-08 01:30:12,This is Kaiya. She's an aspiring shoe model. 12/10 follow your dreams pupper https://t.co/nX8FiGRHvk,12,10,Eskimo dog,35%,True,Norwegian elkhound,20%,True,malamute,14%,True,975,366
1536,674036086168010753,2015-12-08 01:21:40,Meet Daisy. She has no eyes &amp; her face has been blurry since birth. Quite the trooper tho. Still havin a blast. 9/10 https://t.co/jcNdw43BIP,9,10,toy poodle,68%,True,miniature poodle,15%,True,Maltese dog,4%,True,761,181
1537,674024893172875264,2015-12-08 00:37:11,When you realize it doesn't matter how hard you study. You're still going to fail. 10/10 https://t.co/qzYXbyv0SJ,10,10,Pomeranian,64%,True,Pekinese,33%,True,Persian cat,0%,False,1585,1085
1538,674019345211760640,2015-12-08 00:15:09,This is Acro. You briefly see her out of the corner of your eye. You look and she's not there. 10/10 mysterious pup https://t.co/fqiEsTduEs,10,10,collie,99%,True,borzoi,0%,True,Shetland sheepdog,0%,True,1013,264
1539,674014384960745472,2015-12-07 23:55:26,Say hello to Aiden. His eyes are magical. Loves his little Guy Fieri friend. Sneaky tongue slip. 11/10 would caress https://t.co/Ac37LOe3xD,11,10,Pembroke,74%,True,Cardigan,8%,True,Eskimo dog,6%,True,1387,559
1540,674008982932058114,2015-12-07 23:33:58,This pup is sad bc he didn't get to be the toy car. Also he has shitty money management skills. 10/10 still cute tho https://t.co/PiSXXZjDSJ,10,10,jigsaw puzzle,97%,False,prayer rug,1%,False,quill,0%,False,1084,299
1541,673956914389192708,2015-12-07 20:07:04,This is one esteemed pupper. Just graduated college. 10/10 what a champ https://t.co/nyReCVRiyd,10,10,pug,58%,True,Brabancon griffon,8%,True,Chihuahua,4%,True,1748,835
1542,673919437611909120,2015-12-07 17:38:09,This is Obie. He is on guard watching for evildoers from the comfort of his pumpkin. Very brave pupper. 11/10 https://t.co/cdwPTsGEAb,11,10,jack-o'-lantern,17%,False,schipperke,11%,True,miniature pinscher,5%,True,1058,325
1543,673906403526995968,2015-12-07 16:46:21,Guys I'm getting real tired of this. We only rate dogs. Please don't send in other things like this Bulbasaur. 3/10 https://t.co/t5rQHl6W8M,3,10,toilet seat,68%,False,soft-coated wheaten terrier,4%,True,Siberian husky,3%,True,2843,1428
1544,673887867907739649,2015-12-07 15:32:42,When you're having a great time sleeping and your mom comes in and turns on the lights. 10/10 https://t.co/6qYd6BNSPd,10,10,Brabancon griffon,21%,True,Chihuahua,19%,True,golden retriever,16%,True,841,220
1545,673715861853720576,2015-12-07 04:09:13,This is a heavily opinionated dog. Loves walls. Nobody knows how the hair works. Always ready for a kiss. 4/10 https://t.co/dFiaKZ9cDl,4,10,suit,40%,False,bow tie,29%,False,Windsor tie,13%,False,3165,1807
1546,673711475735838725,2015-12-07 03:51:47,ðŸŽ¶ HELLO FROM THE OTHER SIIIIIIIIDE ðŸŽ¶ 10/10 https://t.co/MTOOksRzvH,10,10,Maltese dog,60%,True,toy poodle,14%,True,Sealyham terrier,6%,True,938,264
1547,673709992831262724,2015-12-07 03:45:53,I know a lot of you are studying for finals. Good luck! Here's this. It should help somehow. 12/10 https://t.co/s2ktuPQd79,12,10,Chihuahua,33%,True,Siamese cat,18%,False,kelpie,17%,True,751,236
1548,673708611235921920,2015-12-07 03:40:24,This is Riley. She's just an adorable football fan. 12/10 I'd watch the sports with her https://t.co/kLV8zUCfc8,12,10,golden retriever,93%,True,cocker spaniel,2%,True,Labrador retriever,0%,True,952,253
1549,673707060090052608,2015-12-07 03:34:14,This is Raymond. He's absolutely terrified of floating tennis ball. 10/10 it'll be ok pupper https://t.co/QyH1CaY3SM,10,10,German short-haired pointer,93%,True,kelpie,2%,True,Labrador retriever,0%,True,989,346
1550,673705679337693185,2015-12-07 03:28:45,This is Dot. He found out you only pretended to throw the ball that one time. You don't fuck with Dot. 8/10 https://t.co/Ymg4fwKlZd,8,10,Shih-Tzu,16%,True,Lhasa,11%,True,Yorkshire terrier,6%,True,1124,358
1551,673700254269775872,2015-12-07 03:07:12,Large blue dog here. Cool shades. Flipping us off w both hands. Obviously a preteen. 3/10 for rude blue preteen pup https://t.co/mcPd5AFfhA,3,10,water bottle,61%,False,ashcan,5%,False,bucket,3%,False,1283,500
1552,673697980713705472,2015-12-07 02:58:09,This is Pickles. She's a tiny pointy pupper. Average walker. Very skeptical of wet leaf. 8/10 https://t.co/lepRCaGcgw,8,10,porcupine,15%,False,hen,11%,False,doormat,5%,False,3509,1691
1553,673689733134946305,2015-12-07 02:25:23,When you're having a blast and remember tomorrow's Monday. 11/10 https://t.co/YPsJasNVGe,11,10,Chesapeake Bay retriever,38%,True,American Staffordshire terrier,35%,True,seat belt,9%,False,1539,569
