,tweet_id,timestamp,text,rating_numerator,rating_denominator,p1,p1_conf,p1_dog,p2,p2_conf,p2_dog,p3,p3_conf,p3_dog,favorite_count,retweet_count
387,808501579447930884,2016-12-13 02:39:32,This is Koda. He dug a hole and then sat in it because why not. Unamused by the bath that followed. 12/10 https://t.co/SQhyqrr8px,12,10,Airedale,45%,True,cocker spaniel,21%,True,Irish terrier,9%,True,10733,2452
388,808106460588765185,2016-12-12 00:29:28,Here we have Burke (pupper) and Dexter (doggo). Pupper wants to be exactly like doggo. Both 12/10 would pet at same time https://t.co/ANBpEYHaho,12,10,golden retriever,42%,True,Labrador retriever,25%,True,Great Pyrenees,12%,True,8360,2061
389,808001312164028416,2016-12-11 17:31:39,This is Cooper. He likes to stick his tongue out at you and then laugh about it. 12/10 quite the jokester https://t.co/O9iGgvfuzl,12,10,Labrador retriever,73%,True,Staffordshire bullterrier,13%,True,American Staffordshire terrier,2%,True,11812,3297
390,807621403335917568,2016-12-10 16:22:02,This is Ollie Vue. He was a 3 legged pupper on a mission to overcome everything. This is very hard to write. 14/10 we will miss you Ollie https://t.co/qTRY2qX9y4,14,10,golden retriever,87%,True,cocker spaniel,3%,True,chow,2%,True,13807,3375
391,807106840509214720,2016-12-09 06:17:20,This is Stephan. He just wants to help. 13/10 such a good boy https://t.co/DkBYaCAg2d,13,10,Chihuahua,50%,True,Pomeranian,12%,True,toy terrier,7%,True,111324,51489
392,807010152071229440,2016-12-08 23:53:08,This is Lennon. He's a Boopershnoop Pupperdoop. Quite rare. Exceptionally pettable. 12/10 would definitely boop that shnoop https://t.co/fhgP6vSfhX,12,10,golden retriever,61%,True,Irish setter,21%,True,Welsh springer spaniel,3%,True,12441,3622
393,806629075125202948,2016-12-07 22:38:52,"""Good afternoon class today we're going to learn what makes a good boy so good"" 13/10 https://t.co/f1h2Fsalv9",13,10,Arabian camel,36%,False,house finch,20%,False,cocker spaniel,4%,True,70408,32260
394,806542213899489280,2016-12-07 16:53:43,This is Waffles. He's concerned that the dandruff shampoo he just bought is faulty. 11/10 tragic af https://t.co/BCB87qUU0h,11,10,vizsla,93%,True,Brittany spaniel,3%,True,Chesapeake Bay retriever,0%,True,9714,2213
395,806219024703037440,2016-12-06 19:29:28,We only rate dogs. Please stop sending in non-canines like this Freudian Poof Lion. This is incredibly frustrating... 11/10 https://t.co/IZidSrBvhi,11,10,chow,83%,True,Pomeranian,4%,True,Eskimo dog,2%,True,6124,1132
396,805932879469572096,2016-12-06 00:32:26,This is Major. He put on a tie for his first real walk. Only a little crooked. Can also drool upwards. H*ckin talented. 12/10 https://t.co/Zcwr8LgoO8,12,10,Norwegian elkhound,65%,True,keeshond,31%,True,Leonberg,0%,True,7865,1796
397,805826884734976000,2016-12-05 17:31:15,This is Duke. He is not a fan of the pupporazzi. 12/10 https://t.co/SgpBVYIL18,12,10,Siberian husky,24%,True,American Staffordshire terrier,9%,True,Eskimo dog,8%,True,6219,1711
398,805520635690676224,2016-12-04 21:14:20,This is Zeke the Wonder Dog. He never let that poor man keep his frisbees. One of the Spartans all time greatest receivers. 13/10 RIP Zeke https://t.co/zacX7S6GyJ,13,10,malinois,64%,True,German shepherd,18%,True,Border terrier,10%,True,5473,1548
399,805487436403003392,2016-12-04 19:02:24,"Meet Sansa and Gary. They run along the fence together everyday, so the owners installed a window for them. Both 12/10 h*ckin romantic af https://t.co/1JUduNuaWl",12,10,shield,58%,False,barrel,9%,False,sundial,6%,False,8329,2370
400,805207613751304193,2016-12-04 00:30:29,This is Shooter. He's doing quite the snowy zoom. 12/10 https://t.co/lHy4Xbyhd9,12,10,Pembroke,24%,True,Rhodesian ridgeback,18%,True,Cardigan,9%,True,7467,1624
401,804738756058218496,2016-12-02 17:27:25,This is Django. He accidentally opened the front facing camera. Did him quite the frighten. 12/10 https://t.co/kQVQoOW9NZ,12,10,Tibetan mastiff,91%,True,German shepherd,6%,True,Leonberg,0%,True,12949,3592
402,804026241225523202,2016-11-30 18:16:08,This is Bo. He's going to make me cry. 13/10 please get off the bus for him Carly https://t.co/U7FvBZo6Bq,13,10,web site,49%,False,envelope,5%,False,guillotine,1%,False,41949,14990
403,803773340896923648,2016-11-30 01:31:12,This is Diogi. He fell in the pool as soon as he was brought home. Clumsy puppo. 12/10 would pet until dry https://t.co/ZxeRjMKaWt,12,10,miniature pinscher,81%,True,redbone,5%,True,Irish terrier,3%,True,9531,2581
404,803638050916102144,2016-11-29 16:33:36,Pupper hath acquire enemy. 13/10 https://t.co/ns9qoElfsX,13,10,Labrador retriever,37%,True,golden retriever,34%,True,Great Pyrenees,6%,True,10355,3875
405,803380650405482500,2016-11-28 23:30:47,Meet Sonny. He's an in-home movie critic. That is his collection. He's very proud of it. 12/10 https://t.co/yPbCALoy2n,12,10,bookcase,89%,False,entertainment center,1%,False,file,0%,False,7371,1766
406,803276597545603072,2016-11-28 16:37:19,This is Winston. His selfie game is legendary. Will steal your girl with a single snap. 11/10 handsome as h*ck https://t.co/jxQhxoPsgL,11,10,Pembroke,45%,True,chow,30%,True,golden retriever,4%,True,9519,2292
407,802952499103731712,2016-11-27 19:09:28,This is Marley. She's having a ruff day. Pretty pupset. 12/10 would assist https://t.co/yLm7hQ6UXh,12,10,chow,94%,True,golden retriever,1%,True,Pomeranian,1%,True,8562,1868
408,802572683846291456,2016-11-26 18:00:13,This is Winnie. She's h*ckin ferocious. Dandelion doesn't even see her coming. 12/10 would pet with caution https://t.co/EFfLCP7oQv,12,10,golden retriever,61%,True,Labrador retriever,17%,True,cocker spaniel,16%,True,8496,2349
409,802323869084381190,2016-11-26 01:31:31,This is Severus. He's here to fix your cable. Looks like he succeeded. Even offered to pupgrade your plan. 13/10 h*ckin helpful https://t.co/aX4brLLpWZ,13,10,home theater,76%,False,television,20%,False,entertainment center,1%,False,15303,5459
410,802239329049477120,2016-11-25 19:55:35,This is Loki. He'll do your taxes for you. Can also make room in your budget for all the things you bought today. 12/10 what a puppo https://t.co/5oWrHCWg87,12,10,Eskimo dog,48%,True,Siberian husky,33%,True,malamute,13%,True,8632,2451
411,801958328846974976,2016-11-25 01:18:59,This is Ronnie. He hopes you're having a great day. Nifty tongue slip. 12/10 would pat head approvingly https://t.co/4fY2bsAm65,12,10,Staffordshire bullterrier,32%,True,American Staffordshire terrier,27%,True,Labrador retriever,24%,True,7351,1592
412,801538201127157760,2016-11-23 21:29:33,This is Wallace. He'll be your chau-fur this evening. 12/10 eyes on the road Wallace https://t.co/p1RD39XjUe,12,10,Pembroke,55%,True,Cardigan,30%,True,Shetland sheepdog,5%,True,7796,1950
413,801285448605831168,2016-11-23 04:45:12,oh h*ck 10/10 https://t.co/bC69RrW559,10,10,minivan,78%,False,beach wagon,8%,False,convertible,6%,False,5724,770
414,801167903437357056,2016-11-22 20:58:07,This is Milo. I would do terrible things for Milo. 13/10 https://t.co/R6wJyC2Tey,13,10,cocker spaniel,74%,True,Dandie Dinmont,6%,True,English setter,4%,True,23120,5493
415,801115127852503040,2016-11-22 17:28:25,This is Bones. He's being haunted by another doggo of roughly the same size. 12/10 deep breaths pupper everything's fine https://t.co/55Dqe0SJNj,12,10,dalmatian,82%,True,English setter,9%,True,bluetick,2%,True,7665,1982
416,800751577355128832,2016-11-21 17:23:47,Say hello to Mauve and Murphy. They're rather h*ckin filthy. Preferred nap over bath. Both 12/10 https://t.co/4UwCTW3lXG,12,10,cocker spaniel,77%,True,miniature poodle,7%,True,toy poodle,3%,True,10072,2620
417,800513324630806528,2016-11-21 01:37:04,This is Chef. Chef loves everyone and wants everyone to love each other. 11/10 https://t.co/ILHGs0e6Dm,11,10,Pembroke,82%,True,Cardigan,16%,True,Chihuahua,0%,True,12470,2816
418,800459316964663297,2016-11-20 22:02:27,Here's a very sleepy pupper. Appears to be portable as h*ck. 12/10 would snug intensely https://t.co/61sX7pW5Ca,12,10,teddy,31%,False,ice bear,18%,False,Christmas stocking,17%,False,9028,2056
419,800388270626521089,2016-11-20 17:20:08,This is Doc. He takes time out of every day to worship our plant overlords. 12/10 quite the floofer https://t.co/azMneS6Ly5,12,10,golden retriever,35%,True,Pembroke,19%,True,collie,15%,True,10584,2630
420,800141422401830912,2016-11-20 00:59:15,This is Peaches. She's the ultimate selfie sidekick. Super sneaky tongue slip appreciated. 13/10 https://t.co/pbKOesr8Tg,13,10,golden retriever,93%,True,kuvasz,2%,True,Labrador retriever,2%,True,14487,2383
421,800018252395122689,2016-11-19 16:49:49,Here's a doggo doin a struggle. 11/10 much determined https://t.co/gQqRBfkX4I,11,10,vacuum,28%,False,punching bag,24%,False,barbell,14%,False,26833,12266
422,799757965289017345,2016-11-18 23:35:32,This is Sobe. She's a h*ckin happy doggo. Only one leg tho. Must have good balance. 13/10 would smile back https://t.co/OiH8PaOxB1,13,10,Border collie,44%,True,collie,28%,True,Shetland sheepdog,19%,True,7954,2000
423,799422933579902976,2016-11-18 01:24:14,This is Longfellow (prolly sophisticated). He's a North Appalachian Oatzenjammer. Concerned about wrinkled feets. 12/10 would hug softly https://t.co/bpLuQuxzHZ,12,10,miniature pinscher,58%,True,redbone,27%,True,toy terrier,1%,True,7669,1795
424,799297110730567681,2016-11-17 17:04:16,This is Jeffrey. He's quite the jokester. Takes it too far sometimes. Still 11/10 would pet https://t.co/YDtZcAiMAf,11,10,malamute,98%,True,Siberian husky,0%,True,Eskimo dog,0%,True,9371,2553
425,799063482566066176,2016-11-17 01:35:54,This is Mister. He only wears the most fashionable af headwear. 11/10 h*ckin stylish https://t.co/BXJFKOVnJm,11,10,Norfolk terrier,33%,True,Norwich terrier,23%,True,Australian terrier,21%,True,7682,2337
426,798933969379225600,2016-11-16 17:01:16,This is Iroh. He's in a predicament. 12/10 someone help him https://t.co/KJAKO2kXsL,12,10,Siberian husky,70%,True,Eskimo dog,22%,True,malamute,4%,True,12397,4147
427,798925684722855936,2016-11-16 16:28:21,This is Shadow. He's a firm believer that they're all good dogs. H*ckin passionate about it too. 11/10 I stand with Shadow https://t.co/8yvpacwBcu,11,10,West Highland white terrier,53%,True,cairn,18%,True,Norfolk terrier,16%,True,7149,1356
428,798209839306514432,2016-11-14 17:03:50,This is Cooper. His bow tie was too heavy for the front so he moved it to the side. Balanced af now. 13/10 https://t.co/jG1PAFkB81,13,10,Pekinese,52%,True,Shih-Tzu,10%,True,Pomeranian,9%,True,9903,2418
429,797971864723324932,2016-11-14 01:18:12,Here's a helicopter pupper. He takes off at random. H*ckin hard to control. 12/10 rare af https://t.co/GRWPgNKt2z,12,10,American Staffordshire terrier,48%,True,Chihuahua,30%,True,Staffordshire bullterrier,7%,True,10929,2881
430,797545162159308800,2016-11-12 21:02:38,This is Cassie. She steals things. Guilt increases slightly each time. 12/10 would forgive almost immediately https://t.co/Ia19irLwyB,12,10,Pembroke,95%,True,Cardigan,3%,True,papillon,0%,True,13845,4605
431,797236660651966464,2016-11-12 00:36:46,This is Pancake. She loves Batman and winks like a h*ckin champ. 12/10 real crowd pleaser https://t.co/6kqsAjJNhi,12,10,collie,76%,True,Border collie,10%,True,kelpie,4%,True,18880,6140
432,796865951799083009,2016-11-11 00:03:42,This is Tyr. He's just checking on you. Nifty af tongue slip. 12/10 would absolutely pet https://t.co/Jgnuiyvq06,12,10,Cardigan,83%,True,Boston bull,8%,True,Pembroke,3%,True,7292,1825
433,796759840936919040,2016-11-10 17:02:03,Say hello to Romeo. He was just told that it's too cold for the pool. H*ckin nonsense. 11/10 would help fill up https://t.co/6hx7ur6sNI,11,10,American Staffordshire terrier,46%,True,Staffordshire bullterrier,15%,True,Weimaraner,13%,True,11182,2822
434,796484825502875648,2016-11-09 22:49:15,Here's a sleepy doggo that requested some assistance. 12/10 would carry everywhere https://t.co/bvkkqOjNDV,12,10,cocker spaniel,11%,True,seat belt,10%,False,Australian terrier,9%,True,7169,1647
435,796387464403357696,2016-11-09 16:22:22,This is Snicku. He's having trouble reading because he's a dog. Glasses only helped a little. Nap preferred. 12/10 would snug well https://t.co/cVLUasbKA5,12,10,Pekinese,46%,True,Pomeranian,28%,True,Siamese cat,5%,False,10439,3880
436,796149749086875649,2016-11-09 00:37:46,This is Ruby. She just turned on the news. Officially terrified. 11/10 deep breaths Ruby https://t.co/y5KarNXWXt,11,10,golden retriever,60%,True,Labrador retriever,14%,True,seat belt,8%,False,30439,13328
437,796116448414461957,2016-11-08 22:25:27,I didn't believe it at first but now I can see that voter fraud is a serious h*ckin issue. 11/10 https://t.co/7i0bDMbrVN,11,10,Cardigan,70%,True,Pembroke,26%,True,papillon,1%,True,8616,2245
438,796080075804475393,2016-11-08 20:00:55,This is Yogi. He's 98% floof. Snuggable af. 12/10 https://t.co/opoXKxmfFm,12,10,chow,97%,True,Tibetan mastiff,1%,True,gibbon,0%,False,8008,2158
439,796031486298386433,2016-11-08 16:47:50,This is Daisy. She's here to make your day better. 13/10 mission h*ckin successful https://t.co/PbgvuD0qIL,13,10,golden retriever,89%,True,Labrador retriever,7%,True,doormat,0%,False,10243,3494
440,795464331001561088,2016-11-07 03:14:10,Elder doggo does a splash. Both 13/10 incredible stuff https://t.co/gBUDjdEcqz,13,10,golden retriever,19%,True,Chesapeake Bay retriever,15%,True,soft-coated wheaten terrier,12%,True,46660,21900
441,795400264262053889,2016-11-06 22:59:35,This is Brody. He's trying to make the same face as the football. 12/10 https://t.co/2H4MfOGlpQ,12,10,golden retriever,92%,True,Labrador retriever,5%,True,tennis ball,0%,False,9470,2677
442,795076730285391872,2016-11-06 01:33:58,This is Bailey. She loves going down slides but is very bad at it. Still 11/10 https://t.co/ivPWhspN3E,11,10,gas pump,67%,False,harvester,4%,False,swing,4%,False,15317,5081
443,794926597468000259,2016-11-05 15:37:24,This is Mack. He's rather h*ckin sleepy. Exceptional ears. 12/10 would boop https://t.co/XRPvTPF0VH,12,10,teddy,56%,False,bath towel,17%,False,toy poodle,3%,True,9657,2153
444,794332329137291264,2016-11-04 00:15:59,This is Nimbus (like the cloud). He just bought this fancy af duck raincoat. Only protects one ear tho. 12/10 so h*ckin floofy https://t.co/SIQbb8c3AU,12,10,Samoyed,98%,True,malamute,0%,True,Great Pyrenees,0%,True,9103,2530
445,794205286408003585,2016-11-03 15:51:10,This is Laika. She was a space pupper. The first space pupper actually. Orbited earth like a h*ckin boss. 14/10 hero af https://t.co/trSjgY3h4g,14,10,pedestal,66%,False,fountain,29%,False,brass,2%,False,8756,3105
446,793962221541933056,2016-11-02 23:45:19,This is Maximus. His face is stuck like that. Tragic really. Great tongue tho. 12/10 would pet firmly https://t.co/xIfrsMNLBR,12,10,Labrador retriever,86%,True,golden retriever,4%,True,Staffordshire bullterrier,1%,True,15877,4557
447,793845145112371200,2016-11-02 16:00:06,This is Clark. He was just caught wearing pants. 13/10 game-changing af https://t.co/2Xo19aPrG5,13,10,Old English sheepdog,76%,True,Bedlington terrier,11%,True,Kerry blue terrier,4%,True,8749,1740
448,793601777308463104,2016-11-01 23:53:02,This is Dobby. I can't stop looking at her feet. 12/10 would absolutely snug https://t.co/LhzPWv6rTv,12,10,miniature pinscher,53%,True,Chihuahua,21%,True,toy terrier,8%,True,7551,1512
449,793500921481273345,2016-11-01 17:12:16,This is Fiona. She's an extremely mediocre copilot. Very distracting. Wink makes up for all the missed turns. 12/10 https://t.co/aF5MmpvPqN,12,10,golden retriever,32%,True,Labrador retriever,21%,True,Chesapeake Bay retriever,16%,True,10096,2227
450,793286476301799424,2016-11-01 03:00:09,This is Moreton. He's the Good Boy Who Lived. 13/10 magical as h*ck https://t.co/rLHGx3VAF3,13,10,Afghan hound,27%,True,borzoi,14%,True,doormat,10%,False,23302,8576
451,793271401113350145,2016-11-01 02:00:14,Meet Dave. It's his favorite day of the year. He gets to fulfill his dream of being a dinosaur. 12/10 inspirational af https://t.co/MgQSdfZGPN,12,10,Siberian husky,23%,True,Eskimo dog,20%,True,Pembroke,7%,True,8235,2239
452,793256262322548741,2016-11-01 01:00:05,Oh h*ck look at this spookling right here. Fright level off the charts. 12/10 sufficiently spooked https://t.co/BNy9IIJMb0,12,10,basset,20%,True,Walker hound,6%,True,beagle,4%,True,18887,7776
453,793241302385262592,2016-11-01 00:00:38,This is Tucker. He's out here bustin h*ckin ghosts. 13/10 dedicated af https://t.co/Ap477GhwXt,13,10,golden retriever,55%,True,Labrador retriever,39%,True,cocker spaniel,3%,True,9956,3065
454,793226087023144960,2016-10-31 23:00:11,"This is Juno. She spooked me up real good, but only to get my attention. Above average handwriting for a dog I think. 11/10 https://t.co/hFxxBCWlwj",11,10,wire-haired fox terrier,45%,True,Lakeland terrier,27%,True,English springer,8%,True,9263,2708
455,793210959003287553,2016-10-31 22:00:04,This is Maude. She's the h*ckin happiest wasp you've ever seen. 10/10 would pet with caution https://t.co/etL8FHBrh8,10,10,doormat,87%,False,French bulldog,1%,True,Boston bull,1%,True,8462,2600
456,793195938047070209,2016-10-31 21:00:23,Say hello to Lily. She's pupset that her costume doesn't fit as well as last year. 12/10 poor puppo https://t.co/YSi6K1firY,12,10,Labrador retriever,65%,True,golden retriever,7%,True,Chihuahua,4%,True,14418,5258
457,793180763617361921,2016-10-31 20:00:05,This is Newt. He's a strawberry. 11/10 https://t.co/2VhmlwxA1Q,11,10,Lakeland terrier,26%,True,Irish terrier,21%,True,Airedale,13%,True,6548,1859
458,793165685325201412,2016-10-31 19:00:10,This is Benji. He's Air Bud. It's a low effort costume but he pulls it off rather h*ckin well. 12/10 would happily get dunked on https://t.co/IbzT7DJvBo,12,10,golden retriever,94%,True,Labrador retriever,3%,True,doormat,0%,False,8879,2621
459,793150605191548928,2016-10-31 18:00:14,This is Nida. She's a free elf. Waited so long for this day. 11/10 https://t.co/3lE8Izgmkf,11,10,Italian greyhound,19%,True,bluetick,16%,True,standard poodle,12%,True,5835,1592
460,793135492858580992,2016-10-31 17:00:11,Your favorite squad is looking extra h*ckin spooky today. 13/10 for all https://t.co/PrgvOyPtDT,13,10,bakery,73%,False,saltshaker,5%,False,teddy,4%,False,6065,2349
461,793120401413079041,2016-10-31 16:00:13,"This is Robin. She's desperately trying to do me a frighten, but her tongue drastically decreases her spook value. Still 11/10 great effort https://t.co/sxMrsOZ8zb",11,10,Labrador retriever,72%,True,golden retriever,16%,True,kuvasz,3%,True,11990,3672
462,792913359805018113,2016-10-31 02:17:31,Here is a perfect example of someone who has their priorities in order. 13/10 for both owner and Forrest https://t.co/LRyMrU7Wfq,13,10,web site,22%,False,lighter,8%,False,switch,3%,False,13553,3703
463,792883833364439040,2016-10-31 00:20:11,This is Bailey. She's rather h*ckin hype for Halloween tomorrow. Carved those pupkins herself. 12/10 https://t.co/v17mFm0Ftz,12,10,jack-o'-lantern,99%,False,basketball,0%,False,standard poodle,0%,True,10691,3993
464,792773781206999040,2016-10-30 17:02:53,This is Monster. Not an actual monster tho. He's showing you his tongue. Very impressive Monster. 12/10 would snug https://t.co/RhaPExuxJL,12,10,Yorkshire terrier,91%,True,silky terrier,6%,True,Australian terrier,0%,True,6986,1569
465,792394556390137856,2016-10-29 15:55:58,Meet BeBe. She rocks the messy bun of your dreams. H*ckin flawless. 12/10 would watch her tutorial https://t.co/of0pFNBIl8,12,10,cocker spaniel,74%,True,Irish setter,9%,True,miniature poodle,6%,True,12690,4007
466,792050063153438720,2016-10-28 17:07:05,This is Remus. He's a mop that came to life. Can't see anything. Constantly trips over himself. Still a very good dog. 11/10 https://t.co/S3f1SYylzu,11,10,komondor,94%,True,swab,5%,False,Tibetan terrier,0%,True,6758,1667
467,791672322847637504,2016-10-27 16:06:04,When she says you're a good boy and you know you're a good boy because you're a good boy. 13/10 https://t.co/O5IUmRHRIh,13,10,golden retriever,70%,True,Labrador retriever,21%,True,kuvasz,1%,True,11119,2919
468,791406955684368384,2016-10-26 22:31:36,Say hello to Levi. He's a Madagascan Butterbop. One of the more docile Butterbops I've seen. 12/10 would give all the pets https://t.co/Zcw9Sccctc,12,10,Pembroke,97%,True,Cardigan,2%,True,basenji,0%,True,12467,3846
469,791312159183634433,2016-10-26 16:14:55,This is Mabel. She's super h*ckin smol. Portable af. Comes with the smol shoe. 12/10 would keep in frocket https://t.co/GGJvxYt3xK,12,10,miniature pinscher,89%,True,toy terrier,9%,True,Doberman,0%,True,8304,2359
470,790987426131050500,2016-10-25 18:44:32,This is Misty. She has a cowboy hat on her nose. 12/10 https://t.co/Eno0mypHIr,12,10,cocker spaniel,34%,True,flat-coated retriever,30%,True,Newfoundland,10%,True,9286,1981
471,790946055508652032,2016-10-25 16:00:09,This is Betty. She's assisting with the dishes. Such a good puppo. 12/10 h*ckin helpful af https://t.co/dgvTPZ9tgI,12,10,dishwasher,70%,False,golden retriever,24%,True,chow,3%,True,15836,4375
472,790698755171364864,2016-10-24 23:37:28,This is Mosby. He appears to be rather h*ckin snuggable af. 12/10 keep it up Mosby https://t.co/IiiBq460I7,12,10,Bernese mountain dog,99%,True,EntleBucher,0%,True,Appenzeller,0%,True,7788,1798
473,790581949425475584,2016-10-24 15:53:19,This is Duke. He sneaks into the fridge sometimes. It's his safe place. 11/10 would give little jacket if necessary https://t.co/Fd5WFDTMH4,11,10,refrigerator,99%,False,malinois,0%,True,kelpie,0%,True,19509,6624
474,790337589677002753,2016-10-23 23:42:19,Meet Maggie. She can hear your cells divide. 12/10 can also probably fly https://t.co/ovE2hqXryV,12,10,Pembroke,65%,True,Cardigan,15%,True,toy terrier,10%,True,7407,1763
475,790277117346975746,2016-10-23 19:42:02,This is Bruce. He never backs down from a challenge. 11/10 you got this Bruce https://t.co/aI7umZHIq7,11,10,Labrador retriever,42%,True,Great Dane,19%,True,curly-coated retriever,14%,True,11873,2946
476,789986466051088384,2016-10-23 00:27:05,This is Happy. He's a bathtub reviewer. Seems to be pleased with this one. 12/10 https://t.co/Ln89R4FP7v,12,10,tub,47%,False,bathtub,32%,False,golden retriever,7%,True,8781,2140
477,789628658055020548,2016-10-22 00:45:17,This is Eli. He can fly. 13/10 magical af https://t.co/huPSJJ7FDI,13,10,chow,26%,True,cougar,8%,False,Pomeranian,7%,True,7064,1639
478,789599242079838210,2016-10-21 22:48:24,This is Brownie. She's wearing a Halloween themed onesie. 12/10 festive af https://t.co/0R4meWXFOx,12,10,Chesapeake Bay retriever,87%,True,beagle,1%,True,Labrador retriever,1%,True,6368,1788
479,789530877013393408,2016-10-21 18:16:44,This is Rizzy. She smiles a lot. 12/10 contagious af https://t.co/TU4sZogVIq,12,10,schipperke,36%,True,kelpie,19%,True,Norwegian elkhound,15%,True,11065,3150
480,789268448748703744,2016-10-21 00:53:56,This is Stella. She's happier than I will ever be. 10/10 would trade lives with https://t.co/JSs2bfDtTS,10,10,malamute,81%,True,Siberian husky,12%,True,Eskimo dog,2%,True,8625,2438
481,789137962068021249,2016-10-20 16:15:26,This is Bo. He's a West Congolese Bugaboop Snuggle. Rather exotic. Master of the head tilt. 12/10 would pay to pet https://t.co/2jwxxtNzoN,12,10,Chihuahua,74%,True,Pekinese,7%,True,Pembroke,4%,True,9207,2601
482,788908386943430656,2016-10-20 01:03:11,"This is Lucy. She destroyed not one, but two remotes trying to turn off the debate. 11/10 relatable af https://t.co/3BXh073tDm",11,10,remote control,88%,False,oscilloscope,3%,False,golden retriever,3%,True,26017,11677
483,788765914992902144,2016-10-19 15:37:03,This is Butter. She can have whatever she wants forever. 12/10 would hug softly https://t.co/x5gXRS1abq,12,10,cocker spaniel,50%,True,golden retriever,27%,True,jigsaw puzzle,4%,False,25825,9634
484,788412144018661376,2016-10-18 16:11:17,This is Dexter. He breaks hearts for a living. 11/10 h*ckin handsome af https://t.co/4DhSsC1W7S,11,10,golden retriever,80%,True,Labrador retriever,11%,True,Brittany spaniel,3%,True,14684,4909
485,788178268662984705,2016-10-18 00:41:57,Atlas is back and this time he's got doggles. Still 13/10 solarly conscious af https://t.co/s7MgFWDySc,13,10,Samoyed,73%,True,Pomeranian,7%,True,Arctic fox,3%,False,6880,1967
486,788150585577050112,2016-10-17 22:51:57,This is Leo. He's a golden chow. Rather h*ckin rare. 13/10 would give extra pats https://t.co/xosHjFzVXc,13,10,chow,81%,True,Pomeranian,11%,True,Chihuahua,1%,True,5773,1196
487,788039637453406209,2016-10-17 15:31:05,Did... did they pick out that license plate? 12/10 for both https://t.co/lRmUUOxgbQ,12,10,beach wagon,36%,False,minivan,30%,False,limousine,10%,False,5780,1221
488,787810552592695296,2016-10-17 00:20:47,This is Frank. He wears sunglasses and walks himself. 11/10 I'll never be this cool or independent https://t.co/pNNjBtHWPc,11,10,pug,36%,True,French bulldog,22%,True,English setter,8%,True,8135,2832
489,787717603741622272,2016-10-16 18:11:26,This is Tonks. She is a service puppo. Can hear a caterpillar hiccup from 7 miles away. 13/10 would follow anywhere https://t.co/i622ZbWkUp,13,10,German shepherd,99%,True,malinois,0%,True,kelpie,0%,True,9694,2579
490,787397959788929025,2016-10-15 21:01:17,This is Moose. He's rather h*ckin dangerous (you can tell by the collar). 11/10 would still attempt to snug https://t.co/lHVHGdDzb3,11,10,Chihuahua,90%,True,toy terrier,2%,True,miniature pinscher,1%,True,10312,2658
491,787322443945877504,2016-10-15 16:01:13,This is Lincoln. He forgot to use his blinker when he changed lanes just now. Guilty as h*ck. Still 10/10 https://t.co/lsrR83SiVp,10,10,seat belt,74%,False,golden retriever,10%,True,dingo,1%,False,7376,1621
492,786963064373534720,2016-10-14 16:13:10,This is Rory. He's got an interview in a few minutes. Looking spiffy af. Nervous as h*ck tho. 12/10 would hire https://t.co/ibj5g6xaAj,12,10,golden retriever,91%,True,Saluki,4%,True,Labrador retriever,3%,True,25212,7408
